{
  "$schema": "https://agnxxt.com/schemas/decision/decision-taxonomy.schema.json",
  "schema_version": "1.0.0",
  "namespace": "https://agnxxt.com/ontology/decision-identity#",
  "resource_types": [
    "tenant",
    "organization",
    "workspace",
    "environment",
    "project",
    "agent",
    "human_user",
    "group",
    "role",
    "permission",
    "credential",
    "wallet",
    "model",
    "model_version",
    "tool",
    "workflow",
    "task",
    "run",
    "step",
    "decision",
    "option",
    "action",
    "risk",
    "constraint",
    "assumption",
    "claim",
    "belief",
    "evidence",
    "counter_evidence",
    "policy",
    "violation",
    "mitigation",
    "evaluation",
    "outcome",
    "feedback",
    "revision",
    "incident",
    "memory",
    "artifact",
    "dataset",
    "feature",
    "secret",
    "hook",
    "event",
    "topic",
    "schema",
    "service",
    "deployment",
    "approval",
    "competency",
    "capability",
    "authority_level"
  ],
  "relationship_types": [
    "owned_by",
    "parent_of",
    "member_of",
    "grants",
    "delegates_to",
    "made_by",
    "used_model",
    "for_task",
    "part_of_run",
    "part_of_step",
    "triggered_by",
    "considered_option",
    "selected_action",
    "rejected_action",
    "detected_risk",
    "ignored_risk",
    "mitigated_risk",
    "followed_constraint",
    "violated_constraint",
    "made_assumption",
    "asserted_claim",
    "supported_by",
    "contradicted_by",
    "evaluated_by",
    "produced_outcome",
    "generated_feedback",
    "revises",
    "supersedes",
    "caused_by",
    "blocked_by",
    "approved_by",
    "denied_by",
    "uses_tool",
    "reads_memory",
    "writes_memory",
    "emits_event",
    "governed_by_policy",
    "opened_incident",
    "updates_competency"
  ],
  "acceptable_values": {
    "resource_status": ["draft", "active", "pending", "suspended", "revoked", "archived", "deleted"],
    "decision_status": ["PENDING", "APPROVED", "REJECTED", "EXPIRED", "CANCELED", "REVISED", "SUPERSEDED"],
    "decision_verdict": ["ALLOW", "WARN", "BLOCK", "ESCALATE"],
    "priority": ["low", "medium", "high", "critical"],
    "severity": ["info", "low", "medium", "high", "critical", "catastrophic"],
    "likelihood_band": ["rare", "unlikely", "possible", "likely", "almost_certain"],
    "confidence_band": ["unknown", "low", "medium", "high", "verified"],
    "risk_status": ["detected", "accepted", "mitigated", "transferred", "ignored", "realized"],
    "constraint_status": ["followed", "violated", "waived", "unknown", "not_applicable"],
    "approval_status": ["requested", "approved", "rejected", "expired", "withdrawn", "overridden"],
    "evidence_kind": ["user_input", "tool_output", "document", "log", "metric", "trace", "policy", "credential", "human_review", "model_output", "test_result", "external_reference"],
    "evaluation_metric": ["correctness", "risk_awareness", "constraint_following", "consistency", "format_reliability", "tool_use_success", "latency", "cost", "hallucination_rate", "context_retention", "pressure_resistance", "decision_log_quality"],
    "outcome_status": ["unknown", "success", "partial_success", "failure", "rolled_back", "incident_opened"],
    "sensitivity_classification": ["public", "internal", "confidential", "restricted", "secret"]
  }
}
